{
  "schema_version": 1,
  "source_format": "kss-mesen-screen-buffer-v1",
  "source_sha256": "e7aed668f9698cfa15744594d4c186344f2f6931f56995370eb0070ea13e9350",
  "boundary": "first_end_frame",
  "frame_number": 1,
  "width": 256,
  "height": 239,
  "pixel_format": "rgba8888",
  "forced_blank": true,
  "brightness": 15,
  "uniform": true,
  "nonblack_pixels": 0,
  "rgba_sha256": "c664df7cb2d0d7512f75d4eb998776a29980a051456da362c8152cc14c5416ec"
}
